<?xml version="1.0" encoding="UTF-8"?>
<!DOCTYPE images PUBLIC "-//SPRING//DTD BEAN//EN"
 "http://www.trailmagic.com/dtd/images.dtd">

<!--
 Copyright (c) 2006 Oliver Stewart.  All Rights Reserved.

 This file is free software; you can redistribute it and/or modify
 it under the terms of the GNU General Public License as published by
 the Free Software Foundation; either version 2, or (at your option)
 any later version.

 This file is distributed in the hope that it will be useful,
 but WITHOUT ANY WARRANTY; without even the implied warranty of
 MERCHANTABILITY or FITNESS FOR A PARTICULAR PURPOSE.  See the
 GNU General Public License for more details.
-->

<images>
  <roll>
    <name>import-roll</name>
    <display-name>Import Roll</display-name>
    <description>A roll created for testing.</description>
    <owner>oliver</owner>
  </roll>
  <image>
    <name>oliver-suit-1</name>
    <display-name>Me in a suit</display-name>
    <owner>oliver</owner>
    <caption>lookin' snazzy</caption>
    <copyright>Copyright 2004</copyright>
    <creator>Oliver Stewart</creator>
    <photo-data>
      <roll-name>vanity</roll-name>
      <frame-number>1</frame-number>
      <notes></notes>
      <capture-date>2004-06-12</capture-date>
    </photo-data>
  </image>
</images>